RegionNumber;RegionName;Characters;Question1;Question2;Question3
92;Hauts-de-Seine;Dans quel département se trouve La Défense qu'on voit dans "Miraculous" ?;Dans quel département trouve-t-on Neuilly où habitent tous les YouTubeurs ?;Dans quel département le rappeur Nekfeu a-t-il commencé sa carrière ?
93;Seine-Saint-Denis;Dans quel département se trouve le Stade de France, stade des finales sur FIFA ?;Dans quel département trouve-t-on Saint-Denis qu'on étudie pour les JO 2024 ?;Dans quel département les rappeurs PNL ont-ils tourné leur clip "Au DD" ?
94;Val-de-Marne;Dans quel département se trouve Créteil, ville du handball qu'on voit sur BeIN Sports ?;Dans quel département trouve-t-on le MAC VAL qu'on étudie en arts plastiques ?;Dans quel département le rappeur Rohff a-t-il commencé sa carrière ?
95;Val-d'Oise;Dans quel département se trouve Cergy, ville du rap français des années 2000 ?;Dans quel département trouve-t-on l'Isle Adam qu'on étudie en histoire de l'art ?;Dans quel département le YouTubeur Michou a-t-il fait ses études ?
971;Guadeloupe;Dans quel département se trouve Point-à-Pitre, décor de "Death in Paradise" ?;Dans quel département trouve-t-on la Soufrière qu'on étudie en SVT ?;Dans quel département le YouTubeur Domingo a-t-il fait son stream IRL tropical ?
972;Martinique;Dans quel département se trouve le Diamant, rocher viral sur Instagram ?;Dans quel département trouve-t-on la Montagne Pelée qu'on étudie en SVT ?;Dans quel département le rappeur Kalash a-t-il commencé sa carrière ?
973;Guyane;Dans quel département se trouve Kourou, base spatiale qu'on voit dans "Pour la Science" ?;Dans quel département trouve-t-on la forêt amazonienne qu'on étudie en SVT ?;Dans quel département le YouTubeur Dr Nozman a-t-il fait sa vidéo sur les fusées ?
974;La Réunion;Dans quel département se trouve le Piton de la Fournaise qu'on voit sur YouTube ?;Dans quel département trouve-t-on le cirque de Mafate qu'on étudie en géographie ?;Dans quel département le rappeur Sully Sefil a-t-il grandi ?
976;Mayotte;Dans quel département se trouve le lagon qu'on voit dans les documentaires Netflix ?;Dans quel département trouve-t-on les plages de ponte des tortues qu'on étudie en SVT ?;Dans quel département le YouTubeur L'Ermite Moderne a-t-il fait sa vidéo sur les îles ?